{
  "schema_version": 1,
  "id": "vishalkhadi-campsite",
  "slug": "vishalkhadi-campsite",
  "name": "Vishal Khadi Eco Campsite",
  "type": "eco-campsite",
  "district": "narmada",
  "cluster": "rajpipla",
  "spot_id": null,
  "coordinates": { "lat": 21.7424, "lng": 73.4926, "precision": "approximate" },
  "price_band": "budget",
  "booking": { "mode": "official-portal", "url": "https://ecotourismforest.gujarat.gov.in/Home/Abouts?strsiteid=9WIJDCGgcfw3AOsP9JgcBg%253d%253d", "notes": "Forest Department portal lists 3 rooms from ₹1000 and 2 tents from ₹500 a night. Small site — the whole place books out on long weekends." },
  "contact": "vishalkhadi-ecots@gujarat.gov.in · 9724948910",
  "amenities": ["cottages with attached bath", "tents", "forest walks", "state buses from Rajpipla each morning"],
  "nearest_spots": [
    { "id": "narmada-chhatwada-falls", "distance_km": 7 },
    { "id": "narmada-junaraj", "distance_km": 7 },
    { "id": "narmada-karjan-reservoir", "distance_km": 11 }
  ],
  "notes": "A five-room forest camp on the Rajpipla–Netrang road, roughly 20 km south of Rajpipla, hemmed in by the Karjan and Dediapada forests. The practical bed for the Rajpipla-side waterfalls if the palace hotel is beyond budget.",
  "provenance": {
    "created": "2026-08-11",
    "last_verified": "2026-08-11",
    "confidence": "medium",
    "sources": [
      { "title": "Vishal Khadi — site page, tariffs and contact", "url": "https://ecotourismforest.gujarat.gov.in/Home/Abouts?strsiteid=9WIJDCGgcfw3AOsP9JgcBg%253d%253d", "publisher": "Gujarat Forest Department (official)", "accessed": "2026-08-11" },
      { "title": "Vishal Khadi Eco Campsite", "url": "https://gujarattourism.com/central-zone/narmada/vishal-khadi-eco-campsite.html", "publisher": "Gujarat Tourism (official)", "accessed": "2026-08-11" }
    ],
    "needs_verification": ["coordinates", "amenities"]
  }
}
